{
  "id": "AIADMK",
  "name": "All India Anna Dravida Munnetra Kazhagam",
  "short_name": "AIADMK",
  "color": "#2b8a3e",
  "official_url": "https://aiadmk.com/",
  "_meta": {
    "sources": [
      {
        "url": "https://en.wikipedia.org/wiki/All_India_Anna_Dravida_Munnetra_Kazhagam",
        "name": "Wikipedia - AIADMK",
        "retrieved_at": "2026-04-22T00:00:00+05:30"
      }
    ]
  }
}
